date,title,type,category
"Apr 7, 2020",Providing Federal Support for Governors' Use of the National Guard To Respond to COVID-19,Memoranda,Economy
"Apr 2, 2020",Providing an Order of Succession Within the Pension Benefit Guaranty Corporation,Memoranda,Administrative work
"Apr 2, 2020",Providing Federal Support for Governors' Use of the National Guard To Respond to COVID-19,Memoranda,Economy
"Mar 30, 2020",Extending the Wind-Down Period for Deferred Enforced Departure for Liberians,Memoranda,National security
"Mar 28, 2020",Providing Federal Support for Governors' Use of the National Guard To Respond to COVID-19,Memoranda,Economy
"Mar 30, 2020",Providing Federal Support for Governors' Use of the National Guard To Respond to COVID-19,Memoranda,Economy
"Mar 22, 2020",Providing Federal Support for Governors' Use of the National Guard To Respond to COVID-19,Memoranda,Economy
"Mar 20, 2020",Delegation of Functions Under 31 U.S.C. 5302,Memoranda,Economy
"Mar 13, 2020",Expanding State-Approved Diagnostic Tests,Memoranda,Health care
"Mar 11, 2020",Making General Use Respirators Available,Memoranda,Health care
"Feb 21, 2020",Delegation of Certain Functions and Authorities Under the National Defense Authorization Act for Fiscal Year 2020,Memoranda,National security
"Mar 3, 2020",Delegation of Authority to Re-establish the Presidential Advisory Council on Combating Antibiotic- Resistant Bacteria,Memoranda,Health care
"Feb 19, 2020",Developing and Delivering More Water Supplies to California,Memoranda,Energy
"Jan 29, 2020",Delegation of Certain Authority Under the Federal Service Labor-Management Relations Statute,Memoranda,National security
"Nov 19, 2019",Ocean Mapping of the United States Exclusive Economic Zone and the Shoreline and Nearshore of Alaska,Memoranda,Economy
"Nov 12, 2019",Delegation of Removal Authority Over the Federal Service Impasses Panel,Memoranda,Labor/Immigration
"Oct 11, 2019","Executive Orders 13836, 13837, and 13839",Memoranda,Labor/Immigration
"Sep 24, 2019",Delegation of Functions and Authorities Under the Better Utilization of Investments Leading to Development Act of 2018,Memoranda,Economy
"Sep 6, 2019",Providing an Order of Secession Within the Council on Environmental Quality,Memoranda,Energy
"Aug 21, 2019",Discharging the Federal Student Loan Debt of Totally and Permanently Disabled Veterans,Memoranda,National security
"Jul 19, 2019",Delegation of Authority Under the Asia Reassurance Initiative Act of 2018,Memoranda,National security
"Jul 26, 2019",Reforming Developing-Country Status in the World Trade Organization,Memoranda,National security
"Jun 26, 2019",Policy for Military Service Academy and Reserve Officers' Training Corps Graduates Seeking to Participate in Professional Sports,Memoranda,National security
"May 24, 2019",Delegation of Functions and Authorities Under the Nicaragua Human Rights and Anticorruption Act of 2018,Memoranda,National security
"May 24, 2019",Delegation of Functions and Authorities Under the Sanctioning the Use of Civilians as Defenseless Shields Act,Memoranda,National security
"May 24, 2019","Delegation of Function Under the Hizballah International Financing Prevention Act of 2015, as Amended",Memoranda,National security
"May 24, 2019",Revisions to the 2017 Unified Command Plan,Memoranda,National security
"May 23, 2019",Agency Cooperation With Attorney General's Review of Intelligence Activities Relating to the 2016 Presidential Campaigns,Memoranda,National security
"Apr 30, 2019",Delegation of Authority Under Section 5 of the United States-Caribbean Strategic Engagement Act of 2016,Memoranda,National security
"Apr 22, 2019",Combating High Nonimmigrant Overstay Rates,Memoranda,Labor/Immigration
"Apr 1, 2019",Delaying Submission of the Small Business Report Under the Trade Facilitation and Trade Enforcement Act of 2015,Memoranda,Economy
"Mar 28, 2019",Extension of Deferred Enforced Departure for Liberians,Memoranda,National security
"Mar 27, 2019",Federal Housing Finance Reform,Memoranda,Economy
"Jan 8, 2019",Decision on the United States Consulate General in Jerusalem,Memoranda,National security
"Jan 15, 2019","Delegation of Functions and Authorities Under the Hizballah International Financing Prevention Act of 2015, as Amended, and the Hizballah International Financing Prevention Amendments Act of 2018",Memoranda,National security
"Jan 15, 2019",Delegation of Authorities and Responsibilities Under Section 1763 of the National Defense Authorization Act for Fiscal Year 2019,Memoranda,National security
"Dec 21, 2018",Delegation of Functions and Authorities Under Section 1238 of the FAA Reauthorization Act of 2018,Memoranda,Economy
"Dec 21, 2018",Delegation of Functions and Authorities Under Section 1245 of the National Defense Authorization Act for Fiscal Year 2019,Memoranda,National security
"Dec 18, 2018",Establishment of United States Space Command as a Unified Combatant Command,Memoranda,National security
"Nov 29, 2018",Delegation of Authority Under Section 614(a)(1) of the Foreign Assistance Act of 1961,Memoranda,National security
"Nov 5, 2018",Delegation of Authority Contained in Condition 23 of the Resolution of Advice and Consent to Ratification of the Chemical Weapons Convention,Memoranda,National security
"Nov 26, 2018",Delegation of Authorities Under Section 1757 of the National Defense Authorization Act for Fiscal Year 2019,Memoranda,National security
"Oct 26, 2018",Delegation of Authorities Under Section 1294 of the National Defense Authorization Act for Fiscal Year 2019,Memoranda,National security
"Oct 29, 2018",Delegation of Authority Under Section 1244 of the National Defense Authorization Act for Fiscal Year 2019,Memoranda,National security
"Oct 26, 2018",Delegation of Authority Under Section 1069 of the National Defense Authorization Act for Fiscal Year 2019,Memoranda,National security
"Oct 26, 2018",Delegation of Authority Under Section 3132(d) of the National Defense Authorization Act for Fiscal Year 2019,Memoranda,National security
"Oct 25, 2018",Developing a Sustainable Spectrum Strategy for America's Future,Memoranda,Tech
"Oct 19, 2018",Promoting the Reliable Supply and Delivery of Water in the West,Memoranda,Energy
"Oct 16, 2018",Memorandum for the Secretary of Defense [and] the Secretary of Commerce,Memoranda,National security
"Sep 10, 2018",Delegation of Authority Under Section 1290(b) of the John S. McCain National Defense Authorization Act for Fiscal Year 2019,Memoranda,National security
"Aug 23, 2018",Modernizing the Monetary Reimbursement Model for the Delivery of Goods Through the International Postal System and Enhancing the Security and Safety of International Mail,Memoranda,National security
"Aug 31, 2018",Delegation of Authorities Under the Reinforcing Education Accountability in Development Act,Memoranda,National security
"Jun 4, 2018","Delegation of Authority Under Section 709 of the Department of State Authorities Act, Fiscal Year 2017",Memoranda,National security
"May 16, 2018",Delegation of Authorities Under Section 1244(c) of the National Defense Authorization Act for Fiscal Year 2018,Memoranda,National security
"Jun 18, 2018",National Space Traffic Management Policy,Memoranda,National security
"Apr 26, 2018",Certification for Certain Records Related to the Assassination of President John F. Kennedy,Memoranda,Criminal justice
"Apr 12, 2018",Promoting Domestic Manufacturing and Job CreationPolicies and Procedures Relating to Implementation of Air Quality Standards,Memoranda,Energy
"Apr 6, 2018","Ending ""Catch and Release'' at the Border of the United States and Directing Other Enhancements to Immigration Enforcement",Memoranda,Labor/Immigration
"Apr 4, 2018",Delegation of Authorities Under Section 3136 of the National Defense Authorization Act for Fiscal Year 2018,Memoranda,National security
"Mar 23, 2018",Military Service by Transgender Individuals,Memoranda,National security
"Mar 22, 2018","Actions by the United States Related to the Section 301 Investigation of China's Laws, Policies, Practices, or Actions Related to Technology Transfer, Intellectual Property, and Innovation",Memoranda,National security
"Feb 20, 2018",Delegation of Authorities Under Section 1245 of the National Defense Authorization Act for Fiscal Year 2018,Memoranda,National security
"Feb 8, 2018",Delegation of Certain Functions and Authorities Under Section 1252 of the National Defense Authorization Act for Fiscal Year 2017,Memoranda,National security
"Feb 9, 2018",Delegation of Certain Functions and Authorities Under Section 1235 of the National Defense Authorization Act for Fiscal Year 2018,Memoranda,National security
"Feb 20, 2018","Application of the Definition of Machinegun to ""Bump Fire'' Stocks and Other Similar Devices",Memoranda,National security
"Feb 5, 2018",Delegation of Certain Functions and Authorities Under Section 1238 of the National Defense Authorization Act for Fiscal Year 2018,Memoranda,National security
"Jan 8, 2018",Supporting Broadband Tower Facilities in Rural America on Federal Properties Managed by the Department of the Interior,Memoranda,Tech
"Dec 4, 2017",Delegation of Authority Under Sections 506(a)(2)(A) and 652 of the Foreign Assistance Act of 1961,Memoranda,National security
"Dec 11, 2017",Reinvigorating America's Human Space Exploration Program,Memoranda,National security
"Dec 8, 2017",Delaying Submission of the Small Business Administration Report Under the Trade Facilitation and Trade Enforcement Act of 2015,Memoranda,Economy
"Nov 21, 2017",Delegation of Authority Under the Foreign Aid Transparency and Accountability Act of 2016,Memoranda,National security
"Oct 26, 2017",Combatting the National Drug Demand and Opioid Crisis,Memoranda,Health care
"Oct 26, 2017",Temporary Certification for Certain Records Related to the Assassination of President John F. Kennedy,Memoranda,Criminal justice
"Oct 25, 2017",Unmanned Aircraft Systems Integration Pilot Program,Memoranda,National security
"Oct 11, 2017",Delegation of Certain Functions and Authorities Under the Countering America's Adversaries Through Sanctions Act of 2017,Memoranda,National security
"Sep 25, 2017","Delegation of Authority Under the Consolidated Appropriations Act, 2017",Memoranda,National security
"Sep 8, 2017",Delegation of Authority Under the Global Magnitsky Human Rights Accountability Act,Memoranda,National security
"Sep 25, 2017","Increasing Access to High-Quality Science, Technology, Engineering, and Mathematics (STEM) Education",Memoranda,Economy
"Aug 25, 2017",Military Service by Transgender Individuals,Memoranda,National security
"Aug 15, 2017",Elevation of U.S. Cyber Command to a Unified Combatant Command,Memoranda,Tech
"Aug 14, 2017","Addressing China's Laws, Policies, Practices, and Actions Related to Intellectual Property, Innovation, and Technology",Memoranda,Tech
"Jun 29, 2017","Delegation of Authority Under the Department of State Authorities Act, Fiscal Year 2017",Memoranda,National security
"Jun 29, 2017",Delegation of Authority Under the National Defense Authorization Act for Fiscal Year 1998,Memoranda,National security
"Jun 21, 2017","Delegation of Authority Under the Consolidated Appropriations Act, 2017",Memoranda,National security
"Jun 14, 2017",Effective Date in Executive Order 13780,Memoranda,Labor/Immigration
"Apr 12, 2017",Delegation of Authority Under the National Defense Authorization Act for Fiscal Year 2017,Memoranda,National security
"Mar 19, 2017",Delegation of Authority Under the National Defense Authorization Act for Fiscal Year 2017,Memoranda,National security
"Mar 6, 2017","Implementing Immediate Heightened Screening and Vetting of Applications for Visas and Other Immigration Benefits, Ensuring Enforcement of All Laws for Entry Into the United States, and Increasing Transparency Among Departments and Agencies of the Federal Government and for the American People",Memoranda,Labor/Immigration
"Feb 3, 2017",Fiduciary Duty Rule,Memoranda,Economy
"Jan 28, 2017",Organization of the National Security Council and the Homeland Security Council,Memoranda,National security
"Jan 28, 2017",Plan To Defeat the Islamic State of Iraq and Syria,Memoranda,National security
"Jan 27, 2017",Rebuilding the U.S. Armed Forces,Memoranda,National security
"Jan 24, 2017",Construction of American Pipelines,Memoranda,Energy
"Jan 24, 2017",Construction of the Dakota Access Pipeline,Memoranda,Energy
"Jan 24, 2017",Construction of the Keystone XL Pipeline,Memoranda,Energy
"Jan 24, 2017",Streamlining Permitting and Reducing Regulatory Burdens for Domestic Manufacturing,Memoranda,Economy
"Jan 23, 2017",Hiring Freeze,Memoranda,Administrative work
"Jan 23, 2017",The Mexico City Policy,Memoranda,National security
"Jan 23, 2017",Withdrawal of the United States From the Trans- Pacific Partnership Negotiations and Agreement,Memoranda,National security